id,conversation_id,created_at,date,time,timezone,user_id,username,name,place,tweet,language,mentions,urls,photos,replies_count,retweets_count,likes_count,hashtags,cashtags,link,retweet,quote_url,video,thumbnail,near,geo,source,user_rt_id,user_rt,retweet_id,reply_to,retweet_date,translate,trans_src,trans_dest
1411985073566629893,1411985073566629893,2021-07-05 02:47:29 PDT,2021-07-05,02:47:29,-0700,1004718753890873345,cab_bromley,Citizens Advice Bromley,,"WINNER-@InstituteMA’s Award for Money Adviser of the Year 2021 goes to our debt caseworker Charlotte, now a technical supervisor @CitizensAdvice Congratulations to Charlotte - What a fantastic accolade @BromleyFoodbank @LBofBromley  @BromleyWell  @NHSBromley_CCG  @BromleyTimes  https://t.co/Obb1ToSjET",en,"[{'screen_name': 'institutema', 'name': 'the ima', 'id': '849128532'}, {'screen_name': 'citizensadvice', 'name': 'citizensadvice', 'id': '17632593'}, {'screen_name': 'bromleyfoodbank', 'name': 'bromley foodbank', 'id': '837027552518672384'}, {'screen_name': 'lbofbromley', 'name': 'bromley council', 'id': '55187233'}, {'screen_name': 'bromleywell', 'name': 'bromley well', 'id': '913371434231193600'}, {'screen_name': 'nhsbromley_ccg', 'name': 'bromley ccg', 'id': '1243374325'}, {'screen_name': 'bromleytimes', 'name': 'bromley times', 'id': '94071285'}]",[],['https://pbs.twimg.com/media/E5hg8UKWYAQ4z2u.jpg'],1,4,13,[],[],https://twitter.com/CAB_Bromley/status/1411985073566629893,False,,1,https://pbs.twimg.com/media/E5hg8UKWYAQ4z2u.jpg,,,,,,,[],,,,
1382425346880966666,1382321750839529482,2021-04-14 13:07:41 PDT,2021-04-14,13:07:41,-0700,765049203290677248,flyingmonekys,Flying Monekys,,"@11tulips 40% of people with student debt didn't graduate college, yet they carry a debt burden like they did.  In what year did we decide 8 years of schooling wasn't enough and started paying for high school. In the year 2021 you need a college degree or technical training.",en,[],[],[],0,0,1,[],[],https://twitter.com/FlyingMonekys/status/1382425346880966666,False,,0,,,,,,,,"[{'screen_name': '11tulips', 'name': 'ndweiss, Brokedown Palace, Diabolical Jezebel', 'id': '1042245536'}]",,,,
1239224160917819397,1239224160917819397,2020-03-15 09:17:18 PDT,2020-03-15,09:17:18,-0700,992480227837337600,robmircen,Roberto Mirabelli,,"January year 2021, under extreme market stress and months of severe recession Italy declares default on part of it's debt. A technical government is formed. Other smaller countries soon follow including Greece. #Lagarde resigns and is quickly replaced by Ecb chief economist...",en,[],[],[],0,0,0,['lagarde'],[],https://twitter.com/RobMircen/status/1239224160917819397,False,,0,,,,,,,,[],,,,
1344790133636276224,1344514005608640513,2020-12-31 15:38:47 PST,2020-12-31,15:38:47,-0700,57332943,n1vux,william ricker,,"@marick A few of us who read it 15-20 years ago are still working.  I don't think many of those who joined the industry recently have read old papers, no.  Much ^Agile^ today seems to be micromanagement with license to create technical debt so long as there is a Ticket in the Backlog.",en,[],[],[],0,0,1,[],[],https://twitter.com/n1vux/status/1344790133636276224,False,,0,,,,,,,,"[{'screen_name': 'marick', 'name': 'Brian Marick', 'id': '8864512'}]",,,,
1344784099404251136,1344784099404251136,2020-12-31 15:14:48 PST,2020-12-31,15:14:48,-0700,3906653720,yushwn,Shawn,,"""Technical Debt is the refactoring effort needed to add a feature non-invasively""  https://t.co/dQcVPqwG8v",en,[],['https://michaelfeathers.silvrback.com/toward-a-galvanizing-definition-of-technical-debt'],[],0,0,1,[],[],https://twitter.com/yushwn/status/1344784099404251136,False,,0,,,,,,,,[],,,,
1344776678338387969,1344699467912642562,2020-12-31 14:45:19 PST,2020-12-31,14:45:19,-0700,3074444229,fraclipe,Fran Climent,,"@micael_gallego @vgaltes 'Clean enough' significa, entre otras muchas cosas, que posee tests que te van a permitir pagar esa deuda. Un código con esas característicss no se tira a la basura, se amortiza rápidamente. Otra que no sea eso, por difinición, no es deuda técnica. A mess is not technical debt.",es,[],[],[],1,0,2,[],[],https://twitter.com/fraclipe/status/1344776678338387969,False,,0,,,,,,,,"[{'screen_name': 'micael_gallego', 'name': 'Mica', 'id': '288426731'}, {'screen_name': 'vgaltes', 'name': 'Vicenç Garcia', 'id': '156022246'}]",,,,
1344774014510780416,1344770107017457664,2020-12-31 14:34:44 PST,2020-12-31,14:34:44,-0700,906933319140438016,somsenruben,Ruben Somsen 🚵‍♀️🚵‍♂️🚵🚳,,"@wtogami Correct, it is not completely independent and does add some validation cost, but it's significantly less than fully validating each sidechain.  I propose minimizing technical debt by using Bitcoin Core for the softchains, with only minimal changes (Confidential Transactions?).",en,[],[],[],1,0,2,[],[],https://twitter.com/SomsenRuben/status/1344774014510780416,False,,0,,,,,,,,"[{'screen_name': 'wtogami', 'name': 'Warren Togami', 'id': '592632913'}]",,,,
1344771668678471683,1344770107017457664,2020-12-31 14:25:25 PST,2020-12-31,14:25:25,-0700,592632913,wtogami,Warren Togami,,@SomsenRuben Soft fork requirement is de facto a blocksize increase in that it adds validation cost while adding technical debt to the underlying chain. You can't really consider it an independent chain.,en,[],[],[],2,0,6,[],[],https://twitter.com/wtogami/status/1344771668678471683,False,,0,,,,,,,,"[{'screen_name': 'SomsenRuben', 'name': 'Ruben Somsen 🚵\u200d♀️🚵\u200d♂️🚵🚳', 'id': '906933319140438016'}]",,,,
1344768292708376577,1344768292708376577,2020-12-31 14:12:00 PST,2020-12-31,14:12:00,-0700,480833734,bugsnag,Bugsnag,,"Did you catch the SFELC Summit panel on technical debt? If you didn't, not to worry! We've got the full video available on our website. Click the link to hear technical experts from Okay, Zillow, Lyft, Gusto, and Bugsnag ""Talking Technical Debt.""  https://t.co/TfIaG0iwpi",en,[],['https://zcu.io/BGQd'],[],0,0,0,[],[],https://twitter.com/bugsnag/status/1344768292708376577,False,,0,,,,,,,,[],,,,
1344765184175325185,1324800481600811008,2020-12-31 13:59:39 PST,2020-12-31,13:59:39,-0700,1911072439,mkanesoftware,Matthew/Moshe Kane,,"@mathiasverraes @mattwynne @weralabaj @pauldyson @mfeathers This is how it works in my shop. We have support all the way to the top to manage technical debt and not ignore it and we’re always negotiating with the product team, pay me now or pay me later.",en,[],[],[],0,0,1,[],[],https://twitter.com/MKaneSoftware/status/1344765184175325185,False,,0,,,,,,,,"[{'screen_name': 'mathiasverraes', 'name': 'Mathias Verraes', 'id': '17210045'}, {'screen_name': 'mattwynne', 'name': 'Matt Wynne ✊🏿', 'id': '15994184'}, {'screen_name': 'weralabaj', 'name': 'Weronika Łabaj', 'id': '826858956'}, {'screen_name': 'pauldyson', 'name': 'Paul Dyson', 'id': '20764766'}, {'screen_name': 'mfeathers', 'name': 'Michael Feathers', 'id': '14253068'}]",,,,
1344757013214064642,1344594648145096708,2020-12-31 13:27:10 PST,2020-12-31,13:27:10,-0700,168321389,vegix,Ⓥ𝖊𝖌𝖆𝖓𝖎𝖈 🌿,,"@saxena_puru In fairness, precious metals and crypto are in two completely differentiated asset classes, one has significantly underperformed the expansion of debt and money supply whereas the other has not. From a technical basis, gold has also put in about a 7 year rounded bottom. 1/",en,[],[],[],1,0,0,[],[],https://twitter.com/vegix/status/1344757013214064642,False,,0,,,,,,,,"[{'screen_name': 'saxena_puru', 'name': 'Puru Saxena', 'id': '1033127171298975744'}]",,,,
1344752231476846593,1324800481600811008,2020-12-31 13:08:10 PST,2020-12-31,13:08:10,-0700,17210045,mathiasverraes,Mathias Verraes,,"@hibaymj @ruthmalan And in finance, you pay 5% on your debt and compound interest doubles the debt in 15y. In TD, it's, idk, 80% interest. No one should take out these debts without a negotiation.",en,[],[],[],1,0,2,[],[],https://twitter.com/mathiasverraes/status/1344752231476846593,False,,0,,,,,,,,"[{'screen_name': 'hibaymj', 'name': 'Michael Hibay', 'id': '821533649996750848'}, {'screen_name': 'ruthmalan', 'name': 'Visual Design', 'id': '141165981'}]",,,,
1344748662707138560,1344748658756120576,2020-12-31 12:54:00 PST,2020-12-31,12:54:00,-0700,753018583702175744,monarchwadia,Monarch Wadia,,"sea change in technical education which has the potential to revitalize western productive capacity. What this means for parents of kids currently in high school is a choice between 4 year programs and massive student debt plus another 6 months of waiting to find a job, or",en,[],[],[],1,0,0,[],[],https://twitter.com/monarchwadia/status/1344748662707138560,False,,0,,,,,,,,[],,,,
1344731029588721664,1344731029588721664,2020-12-31 11:43:56 PST,2020-12-31,11:43:56,-0700,274696817,xmlking,Sumanth Chinthagunta (సుమంత్ చింతగుంట),,What is Technical debt?  The Value/Visibility quadrant expresses it well — technical debt is invisible negative value.  https://t.co/0UmjlnkFA4,en,[],[],"['https://pbs.twimg.com/media/EqlxvrnVoAITpZ7.jpg', 'https://pbs.twimg.com/media/EqlxvroUUAA9G8J.jpg']",1,2,3,[],[],https://twitter.com/xmlking/status/1344731029588721664,False,,1,https://pbs.twimg.com/media/EqlxvrnVoAITpZ7.jpg,,,,,,,[],,,,
1344728743529517058,1344629381998768130,2020-12-31 11:34:50 PST,2020-12-31,11:34:50,-0700,854149007211241472,mrdang,Brian Dang,,"@dhawallseth I just make one part at a time. This is the fifth time I'm remaking the app from scratch, tossing out the technical debt completely and copying over the good parts. It gets faster every time 👍",en,[],[],[],0,0,2,[],[],https://twitter.com/mrdang/status/1344728743529517058,False,,0,,,,,,,,"[{'screen_name': 'dhawallseth', 'name': 'Dhawal Seth | #PowerPlatform #Gurgaon', 'id': '140683900'}]",,,,
1344709787813105664,1344709787813105664,2020-12-31 10:19:31 PST,2020-12-31,10:19:31,-0700,1017018024451338240,hyrmn,Ben Hyrman,,Today's standup status: I've retraunched my design decisions into collateralized technical debt obligations and I'm offering the business collared put options against future growth.,en,[],[],[],0,0,0,[],[],https://twitter.com/hyrmn/status/1344709787813105664,False,,0,,,,,,,,[],,,,
1344705375644348419,1344705375644348419,2020-12-31 10:01:59 PST,2020-12-31,10:01:59,-0700,104282770,globallogic,GlobalLogic Inc.,,Microservices are a solid approach to digitally transforming a business by attacking existing technical debt &amp; simplifying complex current scenarios. ⚙️ More in our new whitepaper on strategies for using #microservices to achieve #digitaltransformation:  https://t.co/13yfVAzdZc,en,[],['http://bit.ly/2Ktx30B'],[],0,7,1,"['microservices', 'digitaltransformation']",[],https://twitter.com/GlobalLogic/status/1344705375644348419,False,,0,,,,,,,,[],,,,
1344703699977981959,1344327639402569730,2020-12-31 09:55:20 PST,2020-12-31,09:55:20,-0700,2758312930,m4nl5r,Martin Lechner,,@ctford @davefarley77 I'd rewrite this to be: Inability to quantify the business impact of technical debt.,en,[],[],[],1,0,2,[],[],https://twitter.com/m4nl5r/status/1344703699977981959,False,,0,,,,,,,,"[{'screen_name': 'ctford', 'name': 'Chris Ford', 'id': '20753504'}, {'screen_name': 'davefarley77', 'name': 'Dave Farley', 'id': '223055648'}]",,,,
1344699350752981000,1324800481600811008,2020-12-31 09:38:03 PST,2020-12-31,09:38:03,-0700,1182934651385475072,shoecatladder,Present,,"@mfeathers The problem with ""technical debt"" as a metaphor is that almost zero shops have any intention of ever ""paying off"" the debt",en,[],[],[],0,0,0,[],[],https://twitter.com/shoecatladder/status/1344699350752981000,False,,0,,,,,,,,"[{'screen_name': 'mfeathers', 'name': 'Michael Feathers', 'id': '14253068'}]",,,,
1344698492590014470,1344698492590014470,2020-12-31 09:34:38 PST,2020-12-31,09:34:38,-0700,17543346,chromatic_x,☣purely editorial☣,,"What if we enhanced discussions of ""technical debt"" to include the acid-test ratio?  It might not work. But it might work.",en,[],[],[],1,1,1,[],[],https://twitter.com/chromatic_x/status/1344698492590014470,False,,0,,,,,,,,[],,,,
1344698238369107969,1344695860504846336,2020-12-31 09:33:37 PST,2020-12-31,09:33:37,-0700,1051845583,yvonnezlam,Yvonne Lam,,"I would like us to talk more specifically about technical debt, and in ways that include causation. Because trying to wipe the slate clean and treat it as another technical problem often results in more friction without purchase.",en,[],[],[],0,1,4,[],[],https://twitter.com/yvonnezlam/status/1344698238369107969,False,,0,,,,,,,,[],,,,
1344697042178879489,1344697042178879489,2020-12-31 09:28:52 PST,2020-12-31,09:28:52,-0700,16223373,jorabin,Jo Rabin,,For some reason I have spent the afternoon writing about technical debt.,en,[],[],[],0,0,2,[],[],https://twitter.com/jorabin/status/1344697042178879489,False,,0,,,,,,,,[],,,,
1344687092702588929,1344687092702588929,2020-12-31 08:49:20 PST,2020-12-31,08:49:20,-0700,221162692,ukricha,Richard Atkin,,#Technical debt has many forms...  Me to my Clients: Keep up with the #software #patching!  Project Manager to me: Where’s that detailed design doc?  Client to Sales: What do you mean it has been #EoL for 8 years so you won’t #support it?!  What will you catch up with in #2021?,en,[],[],[],0,0,0,"['technical', 'software', 'patching', 'eol', 'support']",[],https://twitter.com/UKRichA/status/1344687092702588929,False,,0,,,,,,,,[],,,,
1344790133636276224,1344514005608640513,2020-12-31 15:38:47 PST,2020-12-31,15:38:47,-0700,57332943,n1vux,william ricker,,"@marick A few of us who read it 15-20 years ago are still working.  I don't think many of those who joined the industry recently have read old papers, no.  Much ^Agile^ today seems to be micromanagement with license to create technical debt so long as there is a Ticket in the Backlog.",en,[],[],[],0,0,1,[],[],https://twitter.com/n1vux/status/1344790133636276224,False,,0,,,,,,,,"[{'screen_name': 'marick', 'name': 'Brian Marick', 'id': '8864512'}]",,,,
1344784099404251136,1344784099404251136,2020-12-31 15:14:48 PST,2020-12-31,15:14:48,-0700,3906653720,yushwn,Shawn,,"""Technical Debt is the refactoring effort needed to add a feature non-invasively""  https://t.co/dQcVPqwG8v",en,[],['https://michaelfeathers.silvrback.com/toward-a-galvanizing-definition-of-technical-debt'],[],0,0,1,[],[],https://twitter.com/yushwn/status/1344784099404251136,False,,0,,,,,,,,[],,,,
1344776678338387969,1344699467912642562,2020-12-31 14:45:19 PST,2020-12-31,14:45:19,-0700,3074444229,fraclipe,Fran Climent,,"@micael_gallego @vgaltes 'Clean enough' significa, entre otras muchas cosas, que posee tests que te van a permitir pagar esa deuda. Un código con esas característicss no se tira a la basura, se amortiza rápidamente. Otra que no sea eso, por difinición, no es deuda técnica. A mess is not technical debt.",es,[],[],[],1,0,2,[],[],https://twitter.com/fraclipe/status/1344776678338387969,False,,0,,,,,,,,"[{'screen_name': 'micael_gallego', 'name': 'Mica', 'id': '288426731'}, {'screen_name': 'vgaltes', 'name': 'Vicenç Garcia', 'id': '156022246'}]",,,,
1344774014510780416,1344770107017457664,2020-12-31 14:34:44 PST,2020-12-31,14:34:44,-0700,906933319140438016,somsenruben,Ruben Somsen 🚵‍♀️🚵‍♂️🚵🚳,,"@wtogami Correct, it is not completely independent and does add some validation cost, but it's significantly less than fully validating each sidechain.  I propose minimizing technical debt by using Bitcoin Core for the softchains, with only minimal changes (Confidential Transactions?).",en,[],[],[],1,0,2,[],[],https://twitter.com/SomsenRuben/status/1344774014510780416,False,,0,,,,,,,,"[{'screen_name': 'wtogami', 'name': 'Warren Togami', 'id': '592632913'}]",,,,
1344771668678471683,1344770107017457664,2020-12-31 14:25:25 PST,2020-12-31,14:25:25,-0700,592632913,wtogami,Warren Togami,,@SomsenRuben Soft fork requirement is de facto a blocksize increase in that it adds validation cost while adding technical debt to the underlying chain. You can't really consider it an independent chain.,en,[],[],[],2,0,6,[],[],https://twitter.com/wtogami/status/1344771668678471683,False,,0,,,,,,,,"[{'screen_name': 'SomsenRuben', 'name': 'Ruben Somsen 🚵\u200d♀️🚵\u200d♂️🚵🚳', 'id': '906933319140438016'}]",,,,
1344768292708376577,1344768292708376577,2020-12-31 14:12:00 PST,2020-12-31,14:12:00,-0700,480833734,bugsnag,Bugsnag,,"Did you catch the SFELC Summit panel on technical debt? If you didn't, not to worry! We've got the full video available on our website. Click the link to hear technical experts from Okay, Zillow, Lyft, Gusto, and Bugsnag ""Talking Technical Debt.""  https://t.co/TfIaG0iwpi",en,[],['https://zcu.io/BGQd'],[],0,0,0,[],[],https://twitter.com/bugsnag/status/1344768292708376577,False,,0,,,,,,,,[],,,,
1344765184175325185,1324800481600811008,2020-12-31 13:59:39 PST,2020-12-31,13:59:39,-0700,1911072439,mkanesoftware,Matthew/Moshe Kane,,"@mathiasverraes @mattwynne @weralabaj @pauldyson @mfeathers This is how it works in my shop. We have support all the way to the top to manage technical debt and not ignore it and we’re always negotiating with the product team, pay me now or pay me later.",en,[],[],[],0,0,1,[],[],https://twitter.com/MKaneSoftware/status/1344765184175325185,False,,0,,,,,,,,"[{'screen_name': 'mathiasverraes', 'name': 'Mathias Verraes', 'id': '17210045'}, {'screen_name': 'mattwynne', 'name': 'Matt Wynne ✊🏿', 'id': '15994184'}, {'screen_name': 'weralabaj', 'name': 'Weronika Łabaj', 'id': '826858956'}, {'screen_name': 'pauldyson', 'name': 'Paul Dyson', 'id': '20764766'}, {'screen_name': 'mfeathers', 'name': 'Michael Feathers', 'id': '14253068'}]",,,,
1344757013214064642,1344594648145096708,2020-12-31 13:27:10 PST,2020-12-31,13:27:10,-0700,168321389,vegix,Ⓥ𝖊𝖌𝖆𝖓𝖎𝖈 🌿,,"@saxena_puru In fairness, precious metals and crypto are in two completely differentiated asset classes, one has significantly underperformed the expansion of debt and money supply whereas the other has not. From a technical basis, gold has also put in about a 7 year rounded bottom. 1/",en,[],[],[],1,0,0,[],[],https://twitter.com/vegix/status/1344757013214064642,False,,0,,,,,,,,"[{'screen_name': 'saxena_puru', 'name': 'Puru Saxena', 'id': '1033127171298975744'}]",,,,
1344752231476846593,1324800481600811008,2020-12-31 13:08:10 PST,2020-12-31,13:08:10,-0700,17210045,mathiasverraes,Mathias Verraes,,"@hibaymj @ruthmalan And in finance, you pay 5% on your debt and compound interest doubles the debt in 15y. In TD, it's, idk, 80% interest. No one should take out these debts without a negotiation.",en,[],[],[],1,0,2,[],[],https://twitter.com/mathiasverraes/status/1344752231476846593,False,,0,,,,,,,,"[{'screen_name': 'hibaymj', 'name': 'Michael Hibay', 'id': '821533649996750848'}, {'screen_name': 'ruthmalan', 'name': 'Visual Design', 'id': '141165981'}]",,,,
1344748662707138560,1344748658756120576,2020-12-31 12:54:00 PST,2020-12-31,12:54:00,-0700,753018583702175744,monarchwadia,Monarch,,"sea change in technical education which has the potential to revitalize western productive capacity. What this means for parents of kids currently in high school is a choice between 4 year programs and massive student debt plus another 6 months of waiting to find a job, or",en,[],[],[],1,0,0,[],[],https://twitter.com/monarchwadia/status/1344748662707138560,False,,0,,,,,,,,[],,,,
1344731029588721664,1344731029588721664,2020-12-31 11:43:56 PST,2020-12-31,11:43:56,-0700,274696817,xmlking,Sumanth Chinthagunta (సుమంత్ చింతగుంట),,What is Technical debt?  The Value/Visibility quadrant expresses it well — technical debt is invisible negative value.  https://t.co/0UmjlnkFA4,en,[],[],"['https://pbs.twimg.com/media/EqlxvrnVoAITpZ7.jpg', 'https://pbs.twimg.com/media/EqlxvroUUAA9G8J.jpg']",1,2,3,[],[],https://twitter.com/xmlking/status/1344731029588721664,False,,1,https://pbs.twimg.com/media/EqlxvrnVoAITpZ7.jpg,,,,,,,[],,,,
1344728743529517058,1344629381998768130,2020-12-31 11:34:50 PST,2020-12-31,11:34:50,-0700,854149007211241472,mrdang,Brian Dang,,"@dhawallseth I just make one part at a time. This is the fifth time I'm remaking the app from scratch, tossing out the technical debt completely and copying over the good parts. It gets faster every time 👍",en,[],[],[],0,0,2,[],[],https://twitter.com/mrdang/status/1344728743529517058,False,,0,,,,,,,,"[{'screen_name': 'dhawallseth', 'name': 'Dhawal Seth | #PowerPlatform #Gurgaon', 'id': '140683900'}]",,,,
1344709787813105664,1344709787813105664,2020-12-31 10:19:31 PST,2020-12-31,10:19:31,-0700,1017018024451338240,hyrmn,Ben Hyrman,,Today's standup status: I've retraunched my design decisions into collateralized technical debt obligations and I'm offering the business collared put options against future growth.,en,[],[],[],0,0,0,[],[],https://twitter.com/hyrmn/status/1344709787813105664,False,,0,,,,,,,,[],,,,
1344705375644348419,1344705375644348419,2020-12-31 10:01:59 PST,2020-12-31,10:01:59,-0700,104282770,globallogic,GlobalLogic Inc.,,Microservices are a solid approach to digitally transforming a business by attacking existing technical debt &amp; simplifying complex current scenarios. ⚙️ More in our new whitepaper on strategies for using #microservices to achieve #digitaltransformation:  https://t.co/13yfVAzdZc,en,[],['http://bit.ly/2Ktx30B'],[],0,7,1,"['microservices', 'digitaltransformation']",[],https://twitter.com/GlobalLogic/status/1344705375644348419,False,,0,,,,,,,,[],,,,
1344703699977981959,1344327639402569730,2020-12-31 09:55:20 PST,2020-12-31,09:55:20,-0700,2758312930,m4nl5r,Martin Lechner,,@ctford @davefarley77 I'd rewrite this to be: Inability to quantify the business impact of technical debt.,en,[],[],[],1,0,2,[],[],https://twitter.com/m4nl5r/status/1344703699977981959,False,,0,,,,,,,,"[{'screen_name': 'ctford', 'name': 'Chris Ford', 'id': '20753504'}, {'screen_name': 'davefarley77', 'name': 'Dave Farley', 'id': '223055648'}]",,,,
1344699350752981000,1324800481600811008,2020-12-31 09:38:03 PST,2020-12-31,09:38:03,-0700,1182934651385475072,shoecatladder,Present,,"@mfeathers The problem with ""technical debt"" as a metaphor is that almost zero shops have any intention of ever ""paying off"" the debt",en,[],[],[],0,0,0,[],[],https://twitter.com/shoecatladder/status/1344699350752981000,False,,0,,,,,,,,"[{'screen_name': 'mfeathers', 'name': 'Michael Feathers', 'id': '14253068'}]",,,,
1344698492590014470,1344698492590014470,2020-12-31 09:34:38 PST,2020-12-31,09:34:38,-0700,17543346,chromatic_x,☣purely editorial☣,,"What if we enhanced discussions of ""technical debt"" to include the acid-test ratio?  It might not work. But it might work.",en,[],[],[],1,1,1,[],[],https://twitter.com/chromatic_x/status/1344698492590014470,False,,0,,,,,,,,[],,,,
1344698238369107969,1344695860504846336,2020-12-31 09:33:37 PST,2020-12-31,09:33:37,-0700,1051845583,yvonnezlam,Yvonne Lam,,"I would like us to talk more specifically about technical debt, and in ways that include causation. Because trying to wipe the slate clean and treat it as another technical problem often results in more friction without purchase.",en,[],[],[],0,1,4,[],[],https://twitter.com/yvonnezlam/status/1344698238369107969,False,,0,,,,,,,,[],,,,
1344697042178879489,1344697042178879489,2020-12-31 09:28:52 PST,2020-12-31,09:28:52,-0700,16223373,jorabin,Jo Rabin,,For some reason I have spent the afternoon writing about technical debt.,en,[],[],[],0,0,2,[],[],https://twitter.com/jorabin/status/1344697042178879489,False,,0,,,,,,,,[],,,,
1344687092702588929,1344687092702588929,2020-12-31 08:49:20 PST,2020-12-31,08:49:20,-0700,221162692,ukricha,Richard Atkin,,#Technical debt has many forms...  Me to my Clients: Keep up with the #software #patching!  Project Manager to me: Where’s that detailed design doc?  Client to Sales: What do you mean it has been #EoL for 8 years so you won’t #support it?!  What will you catch up with in #2021?,en,[],[],[],0,0,0,"['technical', 'software', 'patching', 'eol', 'support']",[],https://twitter.com/UKRichA/status/1344687092702588929,False,,0,,,,,,,,[],,,,
1344684733494685698,1344427989748965376,2020-12-31 08:39:58 PST,2020-12-31,08:39:58,-0700,4034271,alecmuffett,Alec Muffett,,"@nicoleperlroth @argvee @alexstamos @Niki7a @maddiestone @v3rtig0 @defcon @parityzero @PwnieAwards This is isomorphic to the Google- &amp; Facebook-internal perennial debates of ""Is Fixing Technical Debt Really Properly Recognised As Impact?"" - there's room for both, and it's not necessary to kill ""awards"" just because ""recognising groundwork"" is hard.   https://t.co/CoAaChxutV",en,[],['https://twitter.com/AlecMuffett/status/1344682732492828678'],[],1,0,0,[],[],https://twitter.com/AlecMuffett/status/1344684733494685698,False,https://twitter.com/AlecMuffett/status/1344682732492828678,0,,,,,,,,"[{'screen_name': 'nicoleperlroth', 'name': 'Nicole Perlroth', 'id': '13404292'}, {'screen_name': 'argvee', 'name': 'Heather Adkins - Ꜻ - r00t folding team #258829', 'id': '15363129'}, {'screen_name': 'alexstamos', 'name': 'Alex Stamos', 'id': '41603960'}, {'screen_name': 'Niki7a', 'name': 'Nikita Kronenberg', 'id': '4711518858'}, {'screen_name': 'maddiestone', 'name': 'Maddie Stone', 'id': '2851488433'}, {'screen_name': 'v3rtig0', 'name': 'Russ Rogers (v3rtig0 - Speedrussr)', 'id': '27923690'}, {'screen_name': 'defcon', 'name': 'DEF CON', 'id': '14924965'}, {'screen_name': 'parityzero', 'name': 'Will Harris', 'id': '314256653'}, {'screen_name': 'PwnieAwards', 'name': 'Pwnie Awards', 'id': '36524692'}]",,,,
1344683493306081281,1344683493306081281,2020-12-31 08:35:02 PST,2020-12-31,08:35:02,-0700,14298225,aaronsaray,Aaron Saray,,One of the better explanations from a #dev to explain technical debt to anyone: Technical Debt Is like a Tetris Game  https://t.co/DryQ4kZUw6,en,[],['https://buff.ly/2Qwmwki'],[],0,0,0,['dev'],[],https://twitter.com/aaronsaray/status/1344683493306081281,False,,0,,,,,,,,[],,,,
